Observations	PlotObservationID
Plantago atrata, Alchemilla glaucescens, Achillea seidlii, Acinos alpinus, Anthoxanthum odoratum, Asperula cynanchica, Carex caryophyllea, Crepis conyzifolia, Euphorbia amygdaloides, Euphorbia cyparissias, Festuca nigrescens, Geum montanum, Lotus corniculatus, Poa bulbosa, Senecio squalidus, Trifolium repens, Veronica chamaedrys, Campanula patula, Dianthus capitatus, Galium album, Hypericum linarioides	225924
Carex humilis, Dianthus petraeus, Sesleria rigida, Thymus praecox, Anthyllis montana, Anthyllis vulneraria, Arctostaphylos uva-ursi, Campanula rotundifolia, Chamaecytisus triflorus, Cyanus triumfettii, Daphne cneorum, Euphrasia pectinata, Helianthemum nummularium, Helianthemum oelandicum, Hypericum linarioides, Juniperus communis, Minuartia verna, Pedicularis comosa, Pilosella sabina, Primula veris, Veronica austriaca, Arrhenatherum elatius, Asperula cynanchica, Carum graecum, Convallaria majalis, Cotoneaster integerrimus, Linum flavum, Scabiosa columbaria, Thlaspi kovatsii	225933
Dryas octopetala, Androsace lactea, Arctostaphylos uva-ursi, Carex tristis, Carum graecum, Edraianthus serbicus, Galium anisophyllon, Helianthemum oelandicum, Potentilla apennina, Ranunculus montanus, Saxifraga paniculata, Sesleria rigida, Silene pusilla, Cystopteris fragilis, Festuca panciciana, Minuartia verna, Pedicularis comosa, Thymus praecox	225943
Potentilla apennina, Carex humilis, Dianthus petraeus, Draba aizoides, Leucanthemum vulgare, Poa alpina, Saxifraga paniculata, Sedum ochroleucum, Asplenium ruta-muraria, Asplenium viride, Campanula rotundifolia, Carum graecum, Edraianthus serbicus, Erysimum comatum, Genista subcapitata, Helianthemum oelandicum, Hieracium villosum, Sesleria rigida, Silene pusilla	225945
Sesleria rigida, Arctostaphylos uva-ursi, Rosa caesia, Anemone pulsatilla, Anthyllis montana, Anthyllis vulneraria, Bupleurum falcatum, Carex humilis, Chamaecytisus triflorus, Cotoneaster integerrimus, Cyanus triumfettii, Daphne cneorum, Erysimum comatum, Helianthemum nummularium, Hypochaeris maculata, Lotus corniculatus, Polygala major, Ranunculus montanus, Saxifraga paniculata, Scabiosa columbaria, Thymus praecox, Carum graecum, Dactylorhiza sambucina, Dianthus petraeus, Erysimum carniolicum, Genista pilosa	225959
Saxifraga paniculata, Viola grisebachiana, Ranunculus montanus, Seseli rigidum, Asplenium ruta-muraria, Asplenium trichomanes, Campanula rotundifolia, Edraianthus graminifolius, Hieracium bifidum, Lotus corniculatus, Thymus praecox	225973
Helianthemum oelandicum, Aster alpinus, Carex humilis, Edraianthus graminifolius, Saxifraga porophylla, Bromus erectus, Festuca ovina, Leontodon hispidus, Pedicularis comosa, Poa alpina, Saxifraga paniculata, Sedum hispanicum, Sesleria latifolia, Thymus praecox	226003
Helianthemum oelandicum, Dianthus petraeus, Festuca ovina, Saxifraga paniculata, Saxifraga porophylla, Anthyllis vulneraria, Aster alpinus, Bromus erectus, Carex humilis, Edraianthus graminifolius, Linum catharticum, Sesleria latifolia	226004
Edraianthus graminifolius, Festuca ovina, Helianthemum oelandicum, Saxifraga paniculata, Bromus erectus, Euphrasia minima, Poa alpina, Saxifraga porophylla, Anthyllis vulneraria, Carex montana, Helianthemum nummularium, Linum catharticum, Minuartia verna, Pedicularis comosa, Sedum hispanicum, Thymus praecox	226005
Nardus stricta, Carex pilulifera, Genista sagittalis, Achillea millefolium, Agrostis capillaris, Alchemilla xanthochlora, Briza media, Campanula cervicaria, Cerastium brachypetalum, Dactylorhiza sambucina, Deschampsia flexuosa, Euphrasia rostkoviana, Festuca nigrescens, Gentianella bulgarica, Gymnadenia conopsea, Helianthemum nummularium, Hieracium hoppeanum, Hypochaeris maculata, Inula hirta, Leucanthemum vulgare, Linum catharticum, Minuartia verna, Pedicularis comosa, Plantago lanceolata, Podospermum roseum, Potentilla erecta, Primula elatior, Silene sendtneri, Taraxacum officinale, Thymus praecox, Vaccinium myrtillus, Veronica chamaedrys, Botrychium lunaria, Brachypodium pinnatum, Bupleurum, Campanula patula, Dianthus carthusianorum, Galium album, Galium verum, Gentiana utriculosa, Gymnadenia nigra, Hypericum barbatum, Lotus corniculatus, Myosotis alpestris, Rumex acetosella, Scabiosa columbaria, Silene viscaria, Thesium alpinum, Trifolium alpestre, Veratrum album, Verbascum	226034
Arctostaphylos uva-ursi, Hieracium hoppeanum, Antennaria dioica, Aspilia cachimboensis, Deschampsia flexuosa, Erica spiculifolia, Galium verum, Nardus stricta, Vaccinium myrtillus, Alchemilla glaucescens, Carex caryophyllea, Carex ericetorum, Crocus veluchensis, Genista depressa, Genista sagittalis, Helianthemum nummularium, Hypericum tetrapterum, Linum capitatum, Luzula luzuloides, Luzula multiflora, Ornithogalum collinum, Ranunculus montanus, Sesleria latifolia, Thymus praecox, Trinia glauca, Vaccinium vitis-idaea, Viola rupestris	226054
Cardamine amara, Montia fontana	226085
Phragmites australis, Equisetum palustre, Carex pallescens, Crepis paludosa, Juncus effusus, Lysimachia nummularia, Lythrum salicaria, Potentilla erecta, Caltha palustris, Cirsium palustre, Epilobium palustre, Eriophorum angustifolium, Filipendula ulmaria, Galium palustre, Galium verum, Holcus lanatus, Hypericum maculatum, Mentha longifolia, Menyanthes trifoliata, Ranunculus acris, Silene flos-cuculi, Succisa pratensis	226119
Geum rhodopeum, Trollius europaeus, Geum rivale, Potentilla erecta, Alchemilla reniformis, Alchemilla xanthochlora, Dactylorhiza cordigera, Gymnadenia frivaldii, Sanguisorba officinalis, Alchemilla glabra, Blysmus compressus, Campanula patula, Carex flava, Carex nigra, Carex pallescens, Crepis paludosa, Deschampsia cespitosa, Equisetum sylvaticum, Eriophorum latifolium, Gymnadenia conopsea, Hypericum maculatum, Juncus effusus, Mentha longifolia, Myosotis scorpioides, Persicaria bistorta, Scirpus sylvaticus, Veratrum lobelianum	226192
Eriophorum angustifolium, Carex flava, Carex echinata, Equisetum palustre, Parnassia palustris, Pedicularis palustris, Potentilla erecta, Agrostis canina, Briza media, Carex nigra, Carex pallescens, Crepis paludosa, Dactylorhiza cordigera, Equisetum fluviatile, Filipendula ulmaria, Galium album, Geum rivale, Myosotis scorpioides, Ranunculus acris, Sanguisorba officinalis	226223
Drosera rotundifolia, Agrostis canina, Carex echinata, Carex nigra, Comarum palustre, Equisetum fluviatile, Menyanthes trifoliata, Potentilla erecta, Succisa pratensis, Calamagrostis arundinacea, Carex canescens, Carex flava, Carex rostrata, Eriophorum angustifolium, Lysimachia vulgaris, Lythrum salicaria, Parnassia palustris, Pedicularis palustris, Salix aurita	226240
Salix rosmarinifolia, Betula pubescens, Comarum palustre, Lythrum salicaria, Menyanthes trifoliata, Parnassia palustris, Salix aurita, Bidens campylotheca, Bidens tripartita, Carex canescens, Carex echinata, Carex leporina, Drosera rotundifolia, Equisetum fluviatile, Galium palustre, Lysimachia vulgaris, Ranunculus flammula, Salix alba	226246
Beckmannia eruciformis, Eleocharis palustris, Oenanthe fistulosa, Alisma plantago-aquatica, Carex distans, Carex vulpina, Galium palustre, Lysimachia nummularia, Mentha aquatica, Potentilla reptans, Rorippa austriaca, Rumex conglomeratus, Trifolium fragiferum, Iris pseudacorus	226475
Stipa calamagrostis, Aconitum toxicum, Arabis hirsuta, Asplenium ruta-muraria, Bromus erectus, Campanula rotundifolia, Chamaecytisus triflorus, Dianthus petraeus, Draba aizoides, Festuca panciciana, Galium firmum, Juniperus communis, Melica ciliata, Potentilla cinerea, Rhamnus alpina, Saxifraga paniculata, Scabiosa columbaria, Teucrium chamaedrys, Thymus praecox, Vincetoxicum hirundinaria, Aethionema saxatile, Asplenium trichomanes, Leontodon crispus, Polygala supina	226846
Calamagrostis varia, Asplenium viride, Bupleurum falcatum, Campanula rotundifolia, Carex kitaibeliana, Cystopteris fragilis, Digitalis grandiflora, Helianthemum nummularium, Hepatica nobilis, Juniperus communis, Lathyrus pratensis, Luzula sylvatica, Saxifraga paniculata, Scabiosa ochroleuca, Veronica montana, Veronica urticifolia, Vicia cracca, Genista sagittalis, Helleborus odorus, Heracleum, Ranunculus oreophilus, Salix caprea, Sorbus aria, Thymus praecox, Valeriana officinalis, Verbascum	226856
Armeria maritima, Asplenium trichomanes, Carex humilis, Edraianthus graminifolius, Festuca panciciana, Poa badensis, Ranunculus montanus, Thymus praecox	226863
Achillea ageratifolia, Aster, Carum graecum, Cerastium banaticum, Dianthus petraeus, Silene saxifraga, Allium flavum, Campanula rotundifolia, Edraianthus serbicus, Saxifraga brevifolia, Silene flavescens	226936
Pinus sylvestris, Cotinus coggygria, Pilosella officinarum, Pyrola chlorantha, Taraxacum campylodes, Thalictrum aquilegiifolium, Berberis vulgaris, Cephalanthera rubra, Clinopodium vulgare, Cynoglossum officinale, Eryngium campestre, Galium verum, Geum urbanum, Hieracium praealtum, Juniperus communis, Lactuca muralis, Ligustrum vulgare, Pilosella echioides, Teucrium chamaedrys, Viola suavis	226965
Helianthemum oelandicum, Bromus erectus, Edraianthus graminifolius, Euphrasia minima, Festuca ovina, Saxifraga porophylla, Antennaria dioica, Anthyllis montana, Aster alpinus, Carex humilis, Carex montana, Linum catharticum, Minuartia verna, Pedicularis comosa, Scabiosa micrantha, Sesleria latifolia, Thymus praecox	226981
Eleocharis palustris, Lathyrus pannonicus, Molinia caerulea, Carex distans, Colchicum autumnale, Deschampsia cespitosa, Potentilla erecta, Ranunculus acris, Rhinanthus minor, Trifolium patens, Achillea millefolium, Briza media, Carex depauperata, Carex pilulifera, Cynosurus cristatus, Equisetum palustre, Eriophorum latifolium, Euphrasia rostkoviana, Festuca pratensis, Filipendula vulgaris, Gentiana pneumonanthe, Holcus lanatus, Leucanthemum vulgare, Linum catharticum, Lotus pedunculatus, Oenanthe fistulosa, Ophioglossum vulgatum, Plantago lanceolata, Polygala comosa, Prunella vulgaris, Ranunculus montanus, Ranunculus serpens, Serratula tinctoria, Stachys officinalis, Trifolium hybridum, Trifolium montanum, Trifolium repens	227071
Sesleria tenuifolia, Centaurea kerneriana, Aquilegia grata, Asperula purpurea, Asperula scutellaris, Asplenium ruta-muraria, Athamanta turbith, Clematis vitalba, Dianthus petraeus, Edraianthus tenuifolius, Frangula alnus, Fraxinus ornus, Geranium robertianum, Hieracium waldsteinii, Hippocrepis emerus, Inula ensifolia, Lactuca muralis, Leontodon crispus, Lilium martagon, Polygonatum hirtum, Pseudofumaria alba, Seseli rigidum, Stipa calamagrostis, Thalictrum aquilegiifolium	227097
Sesleria tenuifolia, Dianthus petraeus, Hippocrepis emerus, Aquilegia grata, Asperula purpurea, Campanula rotundifolia, Campanula sibirica, Centaurea kerneriana, Clematis vitalba, Edraianthus graminifolius, Inula ensifolia, Lactuca muralis, Leontodon crispus, Satureja montana, Stipa calamagrostis	227098
Stipa calamagrostis, Melica ciliata, Satureja montana, Aethionema saxatile, Asperula purpurea, Aurinia petraea, Campanula bononiensis, Campanula sibirica, Cardamine glauca, Clematis vitalba, Clinopodium vulgare, Frangula alnus, Hieracium, Hippocrepis emerus, Melampyrum nemorosum, Origanum vulgare, Ostrya carpinifolia, Peucedanum austriacum, Pseudofumaria alba, Scabiosa columbaria, Sedum hispanicum, Seseli rigidum, Silene vulgaris, Stachys recta, Tussilago farfara, Verbascum nigrum	227103
Sesleria rigida, Dianthus petraeus, Ramonda nathaliae, Ramonda serbica, Allium flavum, Asperula aristata, Asperula purpurea, Asplenium trichomanes, Campanula grossekii, Draba lasiocarpa, Hieracium bifidum, Hieracium murorum, Hippocrepis emerus, Jurinea mollis, Leontodon crispus, Paronychia kapela, Sedum album, Silene flavescens, Taraxacum erythrospermum	227115
Asplenium trichomanes, Asplenium viride, Campanula rotundifolia, Cystopteris fragilis, Hieracium humile, Saxifraga paniculata	227142
Saxifraga paniculata, Aquilegia vulgaris, Campanula rotundifolia, Carum graecum, Cystopteris fragilis, Daphne oleoides, Edraianthus graminifolius, Erysimum comatum, Gymnocarpium dryopteris, Hieracium bifidum, Leucanthemum vulgare, Ramonda nathaliae, Selaginella helvetica, Sesleria rigida, Draba aizoides, Silene pusilla	227212
Anthyllis vulneraria, Arctostaphylos uva-ursi, Carum graecum, Dianthus petraeus, Edraianthus graminifolius, Erysimum comatum, Potentilla apennina, Ramonda nathaliae, Ranunculus montanus, Anthyllis montana, Asplenium viride, Campanula rotundifolia, Carex humilis, Cystopteris fragilis, Daphne oleoides, Draba aizoides, Dryas octopetala, Hieracium marmoreum, Poa badensis, Saxifraga paniculata, Sesleria rigida, Silene pusilla, Thymus praecox	227218
Agrostis stolonifera, Juncus gerardii, Trifolium fragiferum, Lotus tenuis, Potentilla anserina, Scorzonera parviflora, Bolboschoenus maritimus, Eleocharis palustris, Taraxacum bessarabicum	227252
Alopecurus geniculatus, Rorippa sylvestris, Agrostis stolonifera, Eleocharis palustris, Gratiola officinalis, Inula britannica, Trifolium repens	227266
Carex echinata, Carex nigra, Drosera rotundifolia, Juncus conglomeratus, Nardus stricta, Potentilla erecta, Alnus alnobetula, Deschampsia cespitosa, Eriophorum angustifolium, Festuca nigrescens, Pinguicula vulgaris, Pseudorchis albida	465750
Carex echinata, Nardus stricta, Pinguicula vulgaris, Potentilla erecta, Alnus alnobetula, Carex nigra, Drosera rotundifolia, Erica spiculifolia, Eriophorum angustifolium, Festuca nigrescens, Gentiana asclepiadea, Juncus conglomeratus, Juniperus communis, Pseudorchis albida, Vaccinium myrtillus, Vaccinium uliginosum	465753
Alnus alnobetula, Juncus conglomeratus, Salix silesiaca, Betula pendula, Carex echinata, Festuca nigrescens, Nardus stricta, Potentilla erecta, Vaccinium myrtillus, Athyrium filix-femina, Dianthus superbus, Drosera rotundifolia, Erica spiculifolia, Galium uliginosum, Gentiana asclepiadea, Geranium sylvaticum, Geum coccineum, Hypericum tetrapterum, Juniperus communis, Persicaria bistorta, Picea abies, Populus tremula, Primula elatior, Rosa pendulina, Rubus proiectus, Senecio duriaei, Silene vulgaris, Soldanella alpina, Thalictrum aquilegiifolium, Veratrum lobelianum	465755
Danthonia alpina, Trifolium campestre, Achillea millefolium, Anthoxanthum odoratum, Filipendula vulgaris, Galium verum, Lotus corniculatus, Plantago lanceolata, Prunella vulgaris, Rhinanthus rumelicus, Thymus pulegioides, Trifolium alpestre, Agrostis capillaris, Aspilia floribunda, Centaurea stoebe, Centaurium erythraea, Chamaecytisus supinus, Eryngium campestre, Euphorbia cyparissias, Hypochaeris maculata, Prunella laciniata, Rosa, Sanguisorba minor, Trifolium patens, Trifolium pratense	1003658
Koeleria pyramidata, Festuca pseudovina, Genista sagittalis, Potentilla alba, Vicia cracca, Achillea millefolium, Campanula cervicaria, Campanula patula, Carex caryophyllea, Colchicum autumnale, Filipendula vulgaris, Pedicularis comosa, Polygala vulgaris, Potentilla hirta, Ranunculus montanus, Sanguisorba minor, Silene sendtneri, Stachys officinalis, Thlaspi praecox, Thymus pulegioides, Trifolium alpestre, Trifolium montanum, Veronica chamaedrys, Allium carinatum, Chamaecytisus hirsutus, Cruciata glabra, Dianthus carthusianorum, Galium aristatum, Galium verum, Lathyrus pratensis, Luzula campestris, Primula elatior, Scabiosa columbaria, Tanacetum corymbosum, Trifolium pannonicum	1003719
Cynosurus cristatus, Agrostis capillaris, Rhinanthus minor, Aira elegantissima, Anthoxanthum odoratum, Festuca rubra, Thymus serpyllum, Achillea millefolium, Anthyllis vulneraria, Asperula cynanchica, Briza media, Campanula patula, Centaurea jacea, Centaurea scabiosa, Cichorium intybus, Convolvulus arvensis, Dactylis glomerata, Danthonia alpina, Daucus carota, Echium vulgare, Euphrasia stricta, Galium verum, Genista sagittalis, Hypochaeris radicata, Juniperus communis, Leucanthemum vulgare, Lotus corniculatus, Malva moschata, Medicago falcata, Polygala comosa, Sanguisorba minor, Trifolium arvense, Trifolium ochroleucon, Trifolium patens, Trifolium repens, Viola arvensis	1003741
Agrostis capillaris, Polygala major, Achillea millefolium, Anthoxanthum odoratum, Carex caryophyllea, Cyanus triumfettii, Festuca rubra, Helianthemum nummularium, Hieracium hoppeanum, Persicaria bistorta, Polygala vulgaris, Rhinanthus serotinus, Seseli peucedanoides, Stachys officinalis, Thesium bavarum, Thymus serpyllum, Trifolium alpestre, Trifolium ochroleucon, Veratrum lobelianum, Carduus candicans, Carlina acaulis, Centaurea biebersteinii, Centaurea solstitialis, Euphorbia cyparissias, Festuca paniculata, Galium verum, Genista sagittalis, Hieracium cymosum, Lathyrus pratensis, Lilium carniolicum, Luzula campestris, Pedicularis heterodonta, Potentilla heptaphylla, Primula veris, Senecio papposus, Stellaria graminea, Verbascum longifolium, Vicia cracca, Viola tricolor	1003756
Bromus erectus, Agrostis capillaris, Anthyllis vulneraria, Asperula cynanchica, Carex caryophyllea, Cerastium banaticum, Cerastium moesiacum, Colchicum autumnale, Festuca rubra, Filipendula vulgaris, Helianthemum nummularium, Hypericum perforatum, Inula hirta, Koeleria pyramidata, Linum catharticum, Minuartia verna, Pedicularis heterodonta, Plantago media, Poa compressa, Polygala major, Potentilla heptaphylla, Primula veris, Rhinanthus minor, Rhinanthus serotinus, Teucrium chamaedrys, Thesium bavarum, Trifolium alpestre, Trifolium ochroleucon, Trifolium pratense, Trifolium repens, Veronica austriaca, Achillea millefolium, Acinos alpinus, Ajuga reptans, Arabis hirsuta, Asperula purpurea, Briza media, Campanula glomerata, Campanula patula, Centaurea phrygia, Cyanus nissanus, Euphorbia cyparissias, Galium album, Galium verum, Genista sagittalis, Geranium sanguineum, Gymnadenia conopsea, Helleborus dumetorum, Hieracium cymosum, Hypericum maculatum, Hypochaeris maculata, Lathyrus pratensis, Leontodon hispidus, Leucanthemum vulgare, Lotus corniculatus, Ranunculus montanus, Scabiosa columbaria, Senecio papposus, Seseli peucedanoides, Silene sendtneri, Stachys officinalis, Stachys recta, Thlaspi ochroleucum, Trifolium aureum, Veratrum lobelianum, Veratrum nigrum, Vicia hirsuta, Viola tricolor	1003764
Cynosurus cristatus, Anthoxanthum odoratum, Ranunculus montanus, Rhinanthus serotinus, Trifolium repens, Astrantia major, Briza media, Colchicum autumnale, Euphrasia rostkoviana, Gentiana utriculosa, Lotus corniculatus, Plantago media, Trifolium montanum, Viola tricolor, Anacamptis morio, Campanula patula, Carum carvi, Centaurea jacea, Cruciata laevipes, Gymnadenia conopsea, Helianthemum nummularium, Helleborus odorus, Pilosella pavichii, Polygala comosa, Rhinanthus rumelicus, Rumex acetosa, Sanguisorba minor, Veronica chamaedrys	1003839
Bromus erectus, Viola tricolor, Festuca valesiaca, Polygala comosa, Ranunculus bulbosus, Sanguisorba minor, Anthoxanthum odoratum, Leontodon hispidus, Leucanthemum vulgare, Linum catharticum, Lotus corniculatus, Plantago media, Silene italica, Thymus pulegioides, Trifolium montanum	1003848
Agrostis capillaris, Anthoxanthum odoratum, Euphorbia cyparissias, Festuca pratensis, Leucanthemum vulgare, Pilosella pavichii, Trifolium patens, Campanula patula, Filipendula vulgaris, Lathyrus sylvestris, Lotus corniculatus, Plantago lanceolata, Potentilla argentea, Prunella laciniata, Salvia verticillata, Securigera varia, Tragopogon duarius, Trifolium pratense, Trifolium repens	1003882
Bothriochloa ischaemum, Achillea seidlii, Chrysopogon gryllus, Dorycnium pentaphyllum, Festuca valesiaca, Pilosella officinarum, Trifolium ochroleucon, Anthemis arvensis, Anthoxanthum odoratum, Chamaecytisus hirsutus, Chondrilla juncea, Cota tinctoria, Dianthus giganteiformis, Eryngium campestre, Genista tinctoria, Helictotrichon pratense, Hieracium praealtum, Hypericum perforatum, Koeleria macrantha, Lepidium campestre, Orlaya grandiflora, Polygala comosa, Prunella laciniata, Rumex acetosa, Sanguisorba minor, Thymus pulegioides, Trifolium alpestre, Trifolium campestre, Trifolium pratense, Trifolium striatum, Veronica spicata	1003911
Festuca paniculata, Carex caryophyllea, Hieracium hoppeanum, Poa variegata, Thymus praecox, Brachypodium pinnatum, Carex kitaibeliana, Cruciata glabra, Genista tinctoria, Helianthemum nummularium, Hypericum maculatum, Luzula campestris, Luzula luzuloides, Persicaria bistorta, Trifolium alpestre, Anthoxanthum odoratum, Aspilia cachimboensis, Crocus veluchensis, Galium verum, Genista sagittalis, Ornithogalum collinum, Rumex acetosella, Sesleria caerulea, Silene sendtneri, Thesium bavarum, Veratrum lobelianum, Verbascum longifolium	1003945
Molinia caerulea, Ranunculus repens, Veratrum album, Achillea millefolium, Carex disticha, Centaurea jacea, Euphorbia epithymoides, Iris sibirica, Iris spuria, Carex globularis, Dasyphyllum tomentosum, Dianthus superbus	1003971
Molinia caerulea, Ranunculus repens, Lotus tenuis, Poa pratensis, Sanguisorba officinalis, Sonchus arvensis, Trifolium repens, Achillea aspleniifolia, Angelica sylvestris, Centaurea jacea, Cirsium brachycephalum, Vicia cracca	1003978
Molinia caerulea, Agrostis stolonifera, Sanguisorba officinalis, Serratula tinctoria, Achillea aspleniifolia, Angelica sylvestris, Equisetum arvense, Lotus corniculatus, Mentha aquatica, Phragmites australis, Vicia cracca, Centaurea jacea, Centaurium littorale, Cichorium intybus, Dasyphyllum tomentosum, Lysimachia vulgaris, Plantago lanceolata, Plantago maritima, Ranunculus acris	1003993
Calamagrostis epigejos, Festuca rupicola, Inula salicina, Salix rosmarinifolia, Veronica spicata, Cytisus austriacus, Galium verum, Helianthemum nummularium, Scabiosa ochroleuca	1004003
Calamagrostis epigejos, Salix rosmarinifolia, Chrysopogon gryllus, Teucrium chamaedrys, Achillea millefolium, Dianthus giganteiformis, Festuca rupicola, Gymnadenia conopsea, Helianthemum nummularium, Lotus corniculatus, Onobrychis arenaria, Pimpinella saxifraga, Polygala comosa, Securigera varia, Stachys recta, Thesium arvense, Tragopogon orientalis	1004011
Salix rosmarinifolia, Scirpoides holoschoenus, Chrysopogon gryllus, Calamagrostis epigejos, Carex praecox, Festuca rupicola, Alyssum montanum, Alyssum tortuosum, Asperula cynanchica, Bothriochloa ischaemum, Festuca vaginata, Helianthemum nummularium, Onobrychis arenaria, Potentilla cinerea, Scabiosa ochroleuca, Stipa capillata, Teucrium chamaedrys	1004012
Cichorium intybus, Festuca pratensis, Trifolium hybridum, Elymus repens, Galium verum, Medicago arabica, Poa pratensis, Tragopogon pratensis, Alopecurus pratensis, Bellis perennis, Carex vulpina, Convolvulus arvensis, Crepis setosa, Dasyphyllum tomentosum, Inula salicina, Lathyrus aphaca, Lotus corniculatus, Plantago major, Rumex crispus, Taraxacum campylodes, Trifolium patens, Trifolium resupinatum	1004050
Veratrum album, Alopecurus pratensis, Equisetum palustre, Silene flos-cuculi, Aegopodium podagraria, Caltha palustris, Dasyphyllum tomentosum, Inula britannica, Rumex acetosa, Stachys palustris	1004064
Equisetum palustre, Ranunculus acris, Dasyphyllum tomentosum, Lysimachia vulgaris, Alopecurus pratensis, Caltha palustris, Euphorbia epithymoides, Sanguisorba officinalis, Serratula tinctoria, Phragmites australis, Rumex acetosa, Taraxacum campylodes, Veratrum album, Vicia cracca	1004066
Alopecurus pratensis, Equisetum palustre, Caltha palustris, Carex elata, Ranunculus acris, Silene flos-cuculi, Taraxacum campylodes, Aegopodium podagraria, Valeriana officinalis	1004069
Alopecurus pratensis, Equisetum palustre, Aegopodium podagraria, Calystegia sepium, Anacamptis coriophora, Anacamptis palustris, Caltha palustris, Festuca pratensis, Orchis militaris, Persicaria lapathifolia, Poa pratensis, Ranunculus acris, Rhinanthus borbasii, Serratula tinctoria, Silene flos-cuculi, Althaea officinalis, Dasyphyllum tomentosum, Lysimachia vulgaris	1004071
Carex acutiformis, Serratula tinctoria, Carex distans, Centaurea jacea, Vicia cracca, Poa trivialis, Ranunculus acris, Stachys palustris, Taraxacum campylodes, Aegopodium podagraria, Alopecurus pratensis, Cichorium intybus, Galium verum, Genista tinctoria, Pastinaca sativa, Sanguisorba officinalis, Silene multiflora	1004072
Scirpus sylvaticus, Juncus effusus, Myosotis scorpioides, Deschampsia cespitosa, Galium palustre, Juncus acutiflorus, Lysimachia nummularia, Agrostis stolonifera, Alopecurus pratensis, Caltha palustris, Eleocharis palustris, Equisetum palustre, Festuca pratensis, Glyceria notata, Juncus articulatus, Juncus thomasii, Poa trivialis, Potentilla erecta, Prunella vulgaris, Ranunculus acris	1004097
Scirpus sylvaticus, Persicaria bistorta, Carex echinata, Crepis paludosa, Filipendula ulmaria, Galeopsis tetrahit, Geum rhodopeum, Impatiens noli-tangere, Lysimachia vulgaris, Myosotis scorpioides, Pogostemon stellatus, Pteridium aquilinum	1004116
Alopecurus pratensis, Agrostis stolonifera, Lythrum salicaria, Inula britannica, Rorippa kerneri, Rumex crispus	1004190
Alopecurus pratensis, Eleocharis palustris, Poa pratensis, Agrostis stolonifera, Inula britannica, Lythrum salicaria, Rorippa kerneri, Rumex crispus	1004194
Hordeum secalinum, Alopecurus rendlei, Poa trivialis, Bromus racemosus, Carex cuprina, Trifolium resupinatum, Carex distans, Carex hirta, Eleocharis palustris, Lolium multiflorum, Lolium perenne, Ranunculus sardous, Ranunculus velutinus, Silene flos-cuculi, Taraxacum campylodes, Tragopogon orientalis, Trifolium fragiferum, Trifolium patens, Alopecurus pratensis, Anthoxanthum odoratum	1004210
Carex divisa, Carex distans, Juncus compressus, Ranunculus sardous, Trifolium fragiferum, Festuca pratensis, Ranunculus acris, Trifolium resupinatum, Anacamptis palustris, Bromus racemosus, Carex cuprina, Eleocharis palustris, Poa trivialis, Trifolium patens, Veronica anagallis-aquatica	1004214
